{
  "agentId": "agt_01JABCDEF0000000000000000",
  "workloadRegistrationId": "wr_01",
  "workloadEvidence": { "type": "spiffe", "verified": true },
  "proof": {
    "iss": "agt_01JABCDEF0000000000000000",
    "sub": "agt_01JABCDEF0000000000000000",
    "aud": "https://id.example.com/org/acme/sts",
    "iat": 1900000000,
    "exp": 1900000300,
    "jti": "jti_01",
    "challengeId": "chl_01",
    "nonce": "n_01"
  }
}
